{"$defs":{"sha":{"pattern":"^[0-9a-f]{64}$","type":"string"}},"$id":"https://atlas-suite.local/schemas/qualification-verification.schema.json","$schema":"https://json-schema.org/draft/2020-12/schema","additionalProperties":false,"properties":{"adapter_bindings_sha256":{"$ref":"#/$defs/sha"},"checks":{"items":{"additionalProperties":false,"properties":{"detail":{"type":"string"},"id":{"type":"string"},"status":{"enum":["passed","failed"]}},"required":["id","status","detail"],"type":"object"},"minItems":1,"type":"array"},"environment_sha256":{"$ref":"#/$defs/sha"},"failures":{"items":{"type":"string"},"type":"array"},"outcome":{"enum":["verified-pass","verified-fail"]},"producer":{"type":"string"},"producer_sha256":{"$ref":"#/$defs/sha"},"profile_id":{"type":"string"},"proof_limit":{"type":"string"},"result_ref":{"type":"string"},"result_sha256":{"$ref":"#/$defs/sha"},"schema":{"const":"atlas-qualification-verification/1.0"},"source_manifest_sha256":{"$ref":"#/$defs/sha"},"verification_id":{"type":"string"},"verification_sha256":{"$ref":"#/$defs/sha"},"verifier":{"type":"string"},"verifier_sha256":{"$ref":"#/$defs/sha"}},"required":["schema","verification_id","profile_id","producer","producer_sha256","verifier","verifier_sha256","result_ref","result_sha256","source_manifest_sha256","adapter_bindings_sha256","environment_sha256","checks","outcome","failures","proof_limit","verification_sha256"],"title":"Atlas independent qualification verification 1.0","type":"object"}
