{"adapter_bindings_sha256":"6bc8e566e5048ebbb76502011644de098bfcd7200f60fa7fb7e825588c864115","checks":[{"detail":"stored result and receipt binding have the same canonical digest","id":"result-digest","status":"passed"},{"detail":"fixture and executable source files are digest-bound","id":"source-manifest","status":"passed"},{"detail":"component owners, adapters, contracts, and source identities are digest-bound","id":"adapter-bindings","status":"passed"},{"detail":"Python, platform, roots, and runtime dependencies are digest-bound","id":"environment-binding","status":"passed"},{"detail":"standalone verifier rebuilt packet, fixture, workflow, production-lock, and adversarial checks","id":"independent-static-replay","status":"passed"},{"detail":"candidate exactly matches independent validation of its embedded runtime artifact or explicit absence","id":"candidate-replay-match","status":"passed"},{"detail":"runtime presence and candidate outcome agree","id":"runtime-evidence-state","status":"passed"}],"environment_sha256":"d3d7bdbd9dd39dfe77e73684c284511bb3f1677fc680b7ff5514ca002b3d8701","failures":[],"outcome":"verified-pass","producer":"scripts/qualification_receipts.py","producer_sha256":"3fa03545b57f058ad7a7b3b15745bd4021c04b2e7733ef515b35b55b110b5a36","profile_id":"ai-tool-control-plane","proof_limit":"Standalone local-process replay validates one observed parent-driven native agent/provider run, frozen evidence, and exact bindings; producer and verifier remain in the same repository and host trust domain. No repeatability, promotion, deployment, or publication claim.","result_ref":"qualification/results/ai-tool-control-plane.result.json","result_sha256":"b4925a879ee339b921c86f9ac6fe170c92af1415a6e43ce64b7a4cca99111c44","schema":"atlas-qualification-verification/1.0","source_manifest_sha256":"a7f942fbcc3684710b5e6637663b7030e3d3e45fdc99d5a1b3db6e40a2f7be5f","verification_id":"verification.ai-tool-control-plane.candidate-1","verification_sha256":"080d78723c53afcef0a80a7298aa3fa1216f2694a45d7d2e6bd45e8b3d620b30","verifier":"scripts/qualification_verifier.py","verifier_sha256":"92c2beb48049e0c8a3090ef9464f9af551b42091515936aeb81574a328743dee"}
