{"adapter_bindings_sha256":"6724d55807d63d7334a3dcbbe863b6f113596cfc2647635cea6883c0dc73d507","checks":[{"detail":"stored result and receipt binding have the same canonical digest","id":"result-digest","status":"passed"},{"detail":"fixture and executable source files are digest-bound","id":"source-manifest","status":"passed"},{"detail":"component owners, adapters, contracts, and source identities are digest-bound","id":"adapter-bindings","status":"passed"},{"detail":"Python, platform, roots, and runtime dependencies are digest-bound","id":"environment-binding","status":"passed"},{"detail":"standalone verifier reran every frozen variant twice with byte-identical canonical suite output","id":"independent-double-replay","status":"passed"},{"detail":"candidate result exactly matches the standalone verifier replay","id":"candidate-replay-match","status":"passed"},{"detail":"stored cases exactly match the frozen case IDs, expectations, and detection layers","id":"frozen-case-ledger","status":"passed"},{"detail":"false-positive and false-negative metrics were recomputed from stored cases","id":"metrics-recomputed","status":"passed"},{"detail":"compatible direct-call versions match the bound environment","id":"runtime-environment","status":"passed"},{"detail":"stored suite passed and recorded byte repeatability","id":"result-outcome","status":"passed"}],"environment_sha256":"8b7eae4c632986baf76ac1af38f4cf9393d4e03fb1fd32d736dcc921a0e95c07","failures":[],"outcome":"verified-pass","producer":"scripts/qualification_receipts.py","producer_sha256":"f281d96c5de7a4558dc2fd4058ee2da4f9550c4b98594f743cfd82a45be49319","profile_id":"fullstack-contract-spine","proof_limit":"Standalone local-process replay and validation of frozen evidence and exact bindings; producer and verifier remain in the same repository and host trust domain. No profile execution, authority, promotion, network, provider, deployment, or publication effect.","result_ref":"qualification/results/fullstack-contract-spine.result.json","result_sha256":"4ac924798b8fd9addacc2c5a90af29b3edec2757daea352228810ad279540096","schema":"atlas-qualification-verification/1.0","source_manifest_sha256":"cda6774c6e0e1b6c70e37e5a48de312b7b58f71a99966d71ce9817cb0d3d128b","verification_id":"verification.fullstack-contract-spine.candidate-1","verification_sha256":"60e0a707b71d7c65014aa00f4930ebecaed41ddf0a0141ffdb743fce668b99d9","verifier":"scripts/qualification_verifier.py","verifier_sha256":"464b230ccb15e022cb3e63a008890df184d75ffb1387ad9d537790ac847f7de4"}
