{"adapter_bindings_sha256":"9df85ad5d1e59a2a6f60fde434fd8ad4f844a5c34d617f4a57147028152a585c","checks":[{"detail":"stored result and receipt binding have the same canonical digest","id":"result-digest","status":"passed"},{"detail":"fixture and executable source files are digest-bound","id":"source-manifest","status":"passed"},{"detail":"component owners, adapters, contracts, and source identities are digest-bound","id":"adapter-bindings","status":"passed"},{"detail":"Python, platform, roots, and runtime dependencies are digest-bound","id":"environment-binding","status":"passed"},{"detail":"standalone verifier rebuilt isolated DKG state twice with byte-identical canonical replay output","id":"independent-double-replay","status":"passed"},{"detail":"candidate result exactly matches the standalone isolated replay with resolved citation hashes","id":"candidate-replay-match","status":"passed"},{"detail":"all seven frozen evidence-firewall checks are present and passed","id":"frozen-check-set","status":"passed"},{"detail":"paired DKG identity satisfies the complete bridge contract","id":"dkg-contract","status":"passed"},{"detail":"stored result binds the DKG Harness Boot receipt digest","id":"upstream-receipt","status":"passed"},{"detail":"stored replay passed without failures and recorded repeatability","id":"result-outcome","status":"passed"}],"environment_sha256":"e286aab0fc25e2bb712ff851cffa56e15ac3c3219327322d52a7785c743470fc","failures":[],"outcome":"verified-pass","producer":"scripts/qualification_receipts.py","producer_sha256":"f281d96c5de7a4558dc2fd4058ee2da4f9550c4b98594f743cfd82a45be49319","profile_id":"rag-evidence-firewall","proof_limit":"Standalone local-process replay and validation of frozen evidence and exact bindings; producer and verifier remain in the same repository and host trust domain. No profile execution, authority, promotion, network, provider, deployment, or publication effect.","result_ref":"qualification/results/rag-evidence-firewall.result.json","result_sha256":"27423258337319607358203d2477626c6c4511ad0da9c62f7c56abd9efca1138","schema":"atlas-qualification-verification/1.0","source_manifest_sha256":"ef6fcf9d3bd4fd13ea0e43da42907760f38240c8d392ddbb4b8ce9cbb8bf00a0","verification_id":"verification.rag-evidence-firewall.candidate-1","verification_sha256":"f3cde686fd547a66a97cb36a4a4278e2ff21e9e0fe5e98d0a5de675fd2a06564","verifier":"scripts/qualification_verifier.py","verifier_sha256":"464b230ccb15e022cb3e63a008890df184d75ffb1387ad9d537790ac847f7de4"}
